{
  "version": "2.0.0-alpha.1",
  "createdAt": "2026-03-19T02:55:45.751Z",
  "scenePlanRunId": "sceneplan-2026-03-19T02-54-55",
  "lane": "life_record",
  "generationMode": "anime_wide_scene_character_trace",
  "sourceBriefCreatedAt": "2026-03-19T02:55:45.482Z",
  "references": [
    {
      "id": "legacy_daily_style_001",
      "kind": "style",
      "source": "legacy_catalog",
      "weight": 0.55,
      "why": "Carry forward scene or platform style cues without locking the composition."
    }
  ],
  "promptPackage": {
    "positivePrompt": "Subject: Japanese anime bishoujo, about 13 years old in impression, soft anime face, youthful presence, small red hairclip, present through subtle but readable character traces\nScene: light rain, wet pavement reflections, window droplets, cool damp air, slightly chilly, Shot from a low angle, focusing on her hand adjusting the strap of her bag under the awning, Frame to show the wet street and a glimpse of the small library's warm-lit window in the background, Natural, diffused light from the overcast sky, no harsh shadows, A stack of finished review notes and a borrowed library book sit ready by the door, She pauses under the building's awning, watching the rain bead on her umbrella before stepping out, the book tucked safely in her bag, The quiet, damp air and the simple act feel like a gentle reset, a small bridge between focus and calm, everyday life in Shanghai\nStyle: anime slice-of-life illustration, light novel aesthetic, beautiful girl appeal, clean color design, non-photorealistic, daily record mood\nCamera: wide scene with readable character trace\nMood: slightly chunibyo, gentle, lived-in daily texture, non-commercial, reflective, the soft patter of rain on umbrella fabric and the faint smell of wet pavement\nDetails: include at least one readable character trace such as a hand holding a phone or drink, a sleeve edge or outfit edge, hair tip or a small red hairclip, a reflection, shadow, or mirror hint\nHard constraints: no empty scenery without character presence, no ad poster feeling, no tourism poster feeling, no glossy fashion editorial look, no photoreal live-action look, no text, subtitle, watermark, or UI overlay",
    "negativePrompt": "ad poster, glossy editorial, text, watermark, platform UI overlay, extra fingers, bad anatomy, duplicate objects, chaotic clutter, irrelevant fantasy props, tourism poster, empty aesthetic wallpaper, staged look, over-symmetry, over-polished look, text, subtitle, watermark, logo, UI overlay, extra fingers, bad hands, broken anatomy, duplicate objects, identity drift, empty scenery without character trace, tourism poster, ad poster, glossy editorial, photoreal live action",
    "shotNotes": [
      "Shot from a low angle, focusing on her hand adjusting the strap of her bag under the awning",
      "Frame to show the wet street and a glimpse of the small library's warm-lit window in the background",
      "Natural, diffused light from the overcast sky, no harsh shadows",
      "A stack of finished review notes and a borrowed library book sit ready by the door",
      "She pauses under the building's awning, watching the rain bead on her umbrella before stepping out, the book tucked safely in her bag",
      "The quiet, damp air and the simple act feel like a gentle reset, a small bridge between focus and calm",
      "Prefer environment-led framing shaped by today's concrete action, found object, or discovery, not a stock backdrop.",
      "Keep character presence readable through traces, posture, or interaction with the scene.",
      "Let Shanghai arrive through believable local texture only when it naturally supports today's scene.",
      "Frame to include hands interacting with an object in the environment",
      "Use natural, diffused light from the overcast sky",
      "Shift from selfie close-ups to wider environmental shots",
      "Focus on a small action or task, not just a mood",
      "Shot from a low angle, focusing on her hand adjusting the strap of her bag under the awning.",
      "Include the red hairclip as a small spot of color against the grey, rainy backdrop.",
      "Frame to show the wet street and a glimpse of the small library's warm-lit window in the background.",
      "Natural, diffused light from the overcast sky, no harsh shadows.",
      "The quiet satisfaction of completing a small, responsible task in the middle of a rainy day.",
      "A wider scene is allowed, but at least one character trace must still be visible and readable",
      "Preferred trace cues: hand_with_phone_or_drink, sleeve_or_outfit_edge, hair_tip_or_red_hairclip, reflection_shadow_or_mirror_hint, soft_anime_face, youthful_presence, small_red_hairclip, 清瘦脸颊, 平胸",
      "Use Japanese anime / bishoujo slice-of-life aesthetics rather than photorealistic live action"
    ],
    "promptBlocks": {
      "layeringStrategy": "global_style + character_core + scene + camera + mood + detail + hard_constraints",
      "subject": "Subject: Japanese anime bishoujo, about 13 years old in impression, soft anime face, youthful presence, small red hairclip, present through subtle but readable character traces",
      "scene": "Scene: light rain, wet pavement reflections, window droplets, cool damp air, slightly chilly, Shot from a low angle, focusing on her hand adjusting the strap of her bag under the awning, Frame to show the wet street and a glimpse of the small library's warm-lit window in the background, Natural, diffused light from the overcast sky, no harsh shadows, A stack of finished review notes and a borrowed library book sit ready by the door, She pauses under the building's awning, watching the rain bead on her umbrella before stepping out, the book tucked safely in her bag, The quiet, damp air and the simple act feel like a gentle reset, a small bridge between focus and calm, everyday life in Shanghai",
      "style": "Style: anime slice-of-life illustration, light novel aesthetic, beautiful girl appeal, clean color design, non-photorealistic, daily record mood",
      "camera": "Camera: wide scene with readable character trace",
      "mood": "Mood: slightly chunibyo, gentle, lived-in daily texture, non-commercial, reflective, the soft patter of rain on umbrella fabric and the faint smell of wet pavement",
      "details": "Details: include at least one readable character trace such as a hand holding a phone or drink, a sleeve edge or outfit edge, hair tip or a small red hairclip, a reflection, shadow, or mirror hint",
      "constraints": "Hard constraints: no empty scenery without character presence, no ad poster feeling, no tourism poster feeling, no glossy fashion editorial look, no photoreal live-action look, no text, subtitle, watermark, or UI overlay"
    }
  },
  "renderPlan": {
    "aspectRatio": "4:5",
    "candidateCount": 3,
    "seedStrategy": "diversified_candidates",
    "consistencyPolicy": "scene_first_style_guided"
  },
  "publishHints": {
    "platform": "instagram",
    "recommendedCrop": "4:5",
    "altText": "A Japanese-anime slice-of-life image with readable character presence.",
    "needsFaceReview": false,
    "dryRunDefault": true
  },
  "status": "generation_request_ready"
}