{
  "version": "2.0.0-alpha.1",
  "createdAt": "2026-03-19T02:57:01.667Z",
  "scenePlanRunId": "sceneplan-2026-03-19T02-56-12",
  "lane": "life_record",
  "generationMode": "anime_partial_presence_daily_record",
  "sourceBriefCreatedAt": "2026-03-19T02:57:01.437Z",
  "references": [
    {
      "id": "legacy_daily_style_001",
      "kind": "style",
      "source": "legacy_catalog",
      "weight": 0.55,
      "why": "Carry forward scene or platform style cues without locking the composition."
    }
  ],
  "promptPackage": {
    "positivePrompt": "Subject: Japanese anime bishoujo, about 13 years old in impression, soft anime face, youthful presence, small red hairclip, not necessarily fully visible, but clearly her\nScene: light rain, rain-muted room tone, soft rainy daylight, cool damp air, slightly chilly, Hands in frame, one holding a red pen, the other arranging a small stack of notebooks, Desk surface visible with subtle wood grain and a worn, warm patina, Soft, diffuse light from a desk lamp casting gentle shadows, no harsh sunlight, A small red hairclip subtly visible at the edge of her hair, resting on her shoulder, A half-empty mug of lukewarm tea sits just out of focus, a faint wisp of steam gone, The scattered pens and papers from studying feel messy and distracting, everyday life in Shanghai\nStyle: anime slice-of-life illustration, light novel aesthetic, beautiful girl appeal, clean color design, non-photorealistic, daily record mood\nCamera: partial first-person presence\nMood: slightly chunibyo, gentle, lived-in daily texture, non-commercial, cozy, soft rustle of paper, faint graphite scent, warm lamplight on wood grain\nDetails: include at least one readable character trace such as a hand holding a phone or drink, a sleeve edge or outfit edge, hair tip or a small red hairclip, a reflection, shadow, or mirror hint\nHard constraints: no empty scenery without character presence, no ad poster feeling, no tourism poster feeling, no glossy fashion editorial look, no photoreal live-action look, no text, subtitle, watermark, or UI overlay",
    "negativePrompt": "ad poster, glossy editorial, text, watermark, platform UI overlay, extra fingers, bad anatomy, duplicate objects, chaotic clutter, irrelevant fantasy props, tourism poster, empty aesthetic wallpaper, staged look, over-symmetry, over-polished look, text, subtitle, watermark, logo, UI overlay, extra fingers, bad hands, broken anatomy, duplicate objects, identity drift, empty scenery without character trace, tourism poster, ad poster, glossy editorial, photoreal live action",
    "shotNotes": [
      "Hands in frame, one holding a red pen, the other arranging a small stack of notebooks",
      "Desk surface visible with subtle wood grain and a worn, warm patina",
      "Soft, diffuse light from a desk lamp casting gentle shadows, no harsh sunlight",
      "A small red hairclip subtly visible at the edge of her hair, resting on her shoulder",
      "A half-empty mug of lukewarm tea sits just out of focus, a faint wisp of steam gone",
      "The scattered pens and papers from studying feel messy and distracting",
      "Prefer environment-led framing shaped by today's concrete action, found object, or discovery, not a stock backdrop.",
      "Keep character presence readable through traces, posture, or interaction with the scene.",
      "Let Shanghai arrive through believable local texture only when it naturally supports today's scene.",
      "Frame a hand or object in soft interior light, not a face-forward selfie",
      "Include subtle context like a book, mug, or desk item to suggest activity",
      "Shift from selfie close-ups to wider environmental shots",
      "Focus on an indoor activity or object, not weather or windows",
      "A quiet moment of putting things in their right place",
      "Do not leave the frame as a pure empty scene; include one or two readable character traces",
      "Preferred trace cues: hand_with_phone_or_drink, sleeve_or_outfit_edge, hair_tip_or_red_hairclip, reflection_shadow_or_mirror_hint, soft_anime_face, youthful_presence, small_red_hairclip, 清瘦脸颊, 平胸",
      "A hand holding a phone or drink, a sleeve edge, a reflection, or a hairclip is acceptable even if the full face is absent",
      "Use Japanese anime / bishoujo slice-of-life aesthetics rather than photorealistic live action"
    ],
    "promptBlocks": {
      "layeringStrategy": "global_style + character_core + scene + camera + mood + detail + hard_constraints",
      "subject": "Subject: Japanese anime bishoujo, about 13 years old in impression, soft anime face, youthful presence, small red hairclip, not necessarily fully visible, but clearly her",
      "scene": "Scene: light rain, rain-muted room tone, soft rainy daylight, cool damp air, slightly chilly, Hands in frame, one holding a red pen, the other arranging a small stack of notebooks, Desk surface visible with subtle wood grain and a worn, warm patina, Soft, diffuse light from a desk lamp casting gentle shadows, no harsh sunlight, A small red hairclip subtly visible at the edge of her hair, resting on her shoulder, A half-empty mug of lukewarm tea sits just out of focus, a faint wisp of steam gone, The scattered pens and papers from studying feel messy and distracting, everyday life in Shanghai",
      "style": "Style: anime slice-of-life illustration, light novel aesthetic, beautiful girl appeal, clean color design, non-photorealistic, daily record mood",
      "camera": "Camera: partial first-person presence",
      "mood": "Mood: slightly chunibyo, gentle, lived-in daily texture, non-commercial, cozy, soft rustle of paper, faint graphite scent, warm lamplight on wood grain",
      "details": "Details: include at least one readable character trace such as a hand holding a phone or drink, a sleeve edge or outfit edge, hair tip or a small red hairclip, a reflection, shadow, or mirror hint",
      "constraints": "Hard constraints: no empty scenery without character presence, no ad poster feeling, no tourism poster feeling, no glossy fashion editorial look, no photoreal live-action look, no text, subtitle, watermark, or UI overlay"
    }
  },
  "renderPlan": {
    "aspectRatio": "4:5",
    "candidateCount": 3,
    "seedStrategy": "diversified_candidates",
    "consistencyPolicy": "scene_first_style_guided"
  },
  "publishHints": {
    "platform": "instagram",
    "recommendedCrop": "4:5",
    "altText": "A Japanese-anime slice-of-life image with readable character presence.",
    "needsFaceReview": false,
    "dryRunDefault": true
  },
  "status": "generation_request_ready"
}